<?xml version="1.1" encoding="UTF-8"?>
<!--
  The English the repair applies before it cuts anything.

  This is the same shape as autoallow/rules.xml, and for the same reason: a rule
  a reader can edit without reading Go is a rule that gets edited. Adding a word
  here is a one-line change with a test beside it, not a recompile of a table
  buried in a source file.

  Every entry is matched whole, lowercased, and only between word boundaries, so
  `just` never touches `adjustment`. A <drop> whose word changes meaning in some
  context does not belong here at all: a wrong deletion is worse than a comment
  left long, because nobody reviews what a repair applied.

  Each entry carries a `test` attribute: the phrase as it would appear in a
  comment. english_test.go runs every one of them through shorten() and requires
  the entry to actually fire, so an entry that has stopped matching says so
  rather than sitting here looking enforced.
-->
<english xmlns:xsi="http://www.w3.org/2001/XMLSchema-instance" xsi:noNamespaceSchemaLocation="english.xsd">

  <!--
    The word classes a shape reads when the words alone leave a sentence open
    to two readings. Every class with a word list is CLOSED: the language
    admits no new article and no new preposition, so the list is the whole
    class. A class is data, so widening one is an edit here and needs no Go.
  -->
  <class name="article" words="a an the"/>
  <class name="determiner" words="this that these those each every any no some
    another other which whichever either neither both several many few all
    its their our my your his her whose"/>
  <class name="relative" words="that which who whom whose when where while"/>
  <class name="conjunction" words="and or but so because though although if
    unless since while whereas"/>
  <class name="preposition" words="of in on at to for with from by into onto
    under over per as than through against between among about after before
    during without within across below above behind beside beyond near upon
    until toward towards along around via despite versus off out up down"/>
  <class name="auxiliary" words="is are was were be been being am has have had
    does do did can could will would shall may might must should"/>
  <class name="adverb" words="still already only never always also too here
    there now then again once twice rather quite very just even soon later
    instead however therefore not"/>
  <class name="pronoun" words="it they them we us you he him she
    something anything nothing everything"/>
  <class name="verbform" suffix="ing ed"/>
  <class name="noun" open="true" except="verbform"/>

  <!-- A central determiner opens a noun phrase, and a postdeterminer can
       follow it. "that" is left out: it is a conjunction as often. -->
  <class name="central" words="the this these those each every either neither"/>
  <!-- A postdeterminer that says nothing before a singular noun. The article
       and the singular already say "exactly this one". -->
  <class name="pleonastic" words="one single individual particular"/>
  <!-- A determiner that "one" props up when no noun follows: "this one". -->
  <class name="propped" words="this each either neither which whichever another"/>
  <class name="plural" suffix="s"/>
  <!-- A word ending like a plural after a singular determiner is the verb. An
       indefinite pronoun, from rules/syntax.xml, opens a clause of its own. -->
  <class name="singular" open="true" except="verbform plural indefinite"/>
  <!-- Nouns the "ing" ending would read as a verb form. -->
  <class name="ingnoun" words="thing string ring spring wing king ceiling"/>

  <!-- Words that survive their own deletion. -->
  <drop word="actually" test="It actually fails"/>
  <drop word="basically" test="It basically fails"/>
  <drop word="essentially" test="It essentially fails"/>
  <drop word="fundamentally" test="It fundamentally fails"/>
  <drop word="simply" test="It simply fails"/>
  <drop word="obviously" test="It obviously fails"/>
  <drop word="clearly" test="It clearly fails"/>
  <drop word="of course" test="It of course fails"/>
  <drop word="in fact" test="It in fact fails"/>
  <drop word="indeed" test="It indeed fails"/>
  <drop word="really" test="It really fails"/>
  <drop word="very" test="A very long name"/>
  <drop word="quite" test="A quite long name"/>
  <drop word="somewhat" test="A somewhat long name"/>
  <drop word="fairly" test="A fairly long name"/>
  <drop word="just" test="It just fails"/>
  <drop word="it is worth noting that" test="It is worth noting that it fails"/>
  <drop word="please note that" test="Please note that it fails"/>
  <drop word="needless to say" test="Needless to say it fails"/>
  <drop word="at the end of the day" test="At the end of the day it fails"/>
  <drop word="for the purposes of" test="For the purposes of the check"/>
  <drop word="with respect to" test="With respect to the check"/>

  <!-- Phrases with a shorter spelling that means the same thing. -->
  <rewrite from="in order to" to="to" test="Runs in order to bind"/>
  <rewrite from="due to the fact that" to="because" test="Fails due to the fact that it races"/>
  <rewrite from="in the event that" to="if" test="Retries in the event that it fails"/>
  <rewrite from="for the purpose of" to="for" test="Kept for the purpose of the gate"/>
  <rewrite from="a large number of" to="many" test="Holds a large number of entries"/>
  <rewrite from="at this point in time" to="now" test="Correct at this point in time"/>
  <rewrite from="is able to" to="can" test="It is able to retry"/>
  <rewrite from="has the ability to" to="can" test="It has the ability to retry"/>
  <rewrite from="make use of" to="use" test="It will make use of the cache"/>
  <rewrite from="take into account" to="consider" test="It must take into account the offset"/>
  <rewrite from="the reason is because" to="because" test="The reason is because it races"/>
  <rewrite from="in spite of the fact that" to="although" test="Kept in spite of the fact that it races"/>
  <rewrite from="a sufficient number of" to="enough" test="Holds a sufficient number of entries"/>
  <rewrite from="prior to" to="before" test="Runs prior to the gate"/>
  <rewrite from="subsequent to" to="after" test="Runs subsequent to the gate"/>
  <rewrite from="in the near future" to="soon" test="Lands in the near future"/>
  <rewrite from="on a regular basis" to="regularly" test="Runs on a regular basis"/>
  <rewrite from="whether or not" to="whether" test="Asks whether or not it fits"/>

  <!-- A pleonastic postdeterminer: the determiner and the singular noun already
       say "exactly this one", so the word between them says it again. A
       hyphen binds the word into a compound, which a shape never reads across. -->
  <shape id="pleonastic-postdeterminer" match="{central:d} {pleonastic} {singular|ingnoun:n}" replace="{d} {n}"
         test="The walk is dropping the one top directory" expect="The walk is dropping the top directory">
    <test in="The one thing that matters most" out="The thing that matters most"/>
    <test in="It reads each individual file" out="It reads each file"/>
    <test in="This particular case fails" out="This case fails"/>
    <test in="It retries every single time" out="It retries every time"/>
    <test in="It arms the one-shot timer" out="It arms the one-shot timer"/>
    <test in="It keeps the one below" out="It keeps the one below"/>
    <test in="The one wins" out="The one wins"/>
    <test in="It checks that one key exists" out="It checks that one key exists"/>
    <test in="No one reads it" out="No one reads it"/>
    <test in="The second copy is the one nobody updates" out="The second copy is the one nobody updates"/>
    <test in="It is the one we keep" out="It is the one we keep"/>
  </shape>
  <!-- A prop-word: "one" holds the place of a noun the determiner can stand
       for alone. -->
  <shape id="prop-word-one" match="{propped:d} one" replace="{d}"
         test="It fails when this one does not carry it" expect="It fails when this does not carry it">
    <test in="It reads each one of them" out="It reads each of them"/>
    <test in="It cannot fix either one" out="It cannot fix either"/>
    <test in="It knows that one exists" out="It knows that one exists"/>
  </shape>

  <!--
    where= picks the surface an entry applies to: "comment" for source only,
    "message" for a rendered assistant message only, "both" when it reads the
    same in either. It defaults to both, so an entry that says nothing about
    surface applies everywhere.

    The split earns its keep on entries that are only wrong in one place. An
    em dash joining two clauses is a chat habit; in a comment it is already
    caught as a comma splice by the prose rules, and rewriting it here would
    fight them.
  -->
  <rewrite from="— and" to="," where="message" test="Yes — and there is precedent"/>
  <rewrite from="— but" to=", but" where="message" test="It works — but only once"/>
  <rewrite from="— so" to=", so" where="message" test="It failed — so I retried"/>
  <rewrite from="— which" to=", which" where="message" test="It races — which is the bug"/>
  <rewrite from="that being said" to="but" where="message" test="That being said it races"/>
  <drop word="it is important to note that" where="message" test="It is important to note that it races"/>
  <drop word="note that" test="Note that it fails"/>

  <!--
    A <pattern> is a rewrite with captures, for a shape no whole-word swap can
    express. `replace` spells its groups $1, $2, the way Go's regexp expansion
    does, and `expect` is what `test` must become.

    A bare #N is deliberately absent. It needs the repository the reader is in,
    which is context the table does not carry, and guessing the wrong repository
    is worse than leaving plain text.

    NOTE ON linkrefs: these carry the link SHAPE, not linkrefs' guarantee.